disease_name,pathogen,symptoms,development,hosts_distribution,importance,treatments
Leaf Rust (Brown Rust),Puccinia recondita,"The pustules are circular or slightly elliptical, smaller than those of stem rust, usually do not coalesce, and contain masses of orange to orange-brown urediospores. Infection sites primarily are found on the upper surfaces of leaves and leaf sheaths (1 ), and occasionally on the neck and awns.","Primary infections usually are light and develop from wind-borne urediospores that may have travelled long distances. The disease can develop rapidly when free moisture is available and temperatures are near 20°C. Successive generations of urediospores can be produced every 10-1 4 days if conditions are favorable. As plants mature or when environmental conditions are not favorable, masses of black teliospores may become evident (2).","Leaf rust can affect wheat, triticale and many other related grasses. The disease is found w.herever temperate cereals are grown. The alternate hosts are Thalictrum, Isopryum, Anemonella, and Anchusa spp.","Severe early infections can cause significant yield losses, mainly by reducing the number of kernels per spike, test weights, and kernel quality.",Use resistant cultivars; Apply fungicides such as propiconazole or tebuconazole at early infection stages; Practice crop rotation; Remove alternate hosts
Stem Rust (Black Rust),Puccinia graminis f .sp. rritici,"Pustules (containing masses of urediospores) are dark reddish brown, and may occur on both sides of the leaves, on the stems, and on the spikes (3). With light infections the pustules are usually separate and scattered, but with heavy infections they may coalesce. Prior to pustule formation, ""flecks"" may appear. Before the spore masses break through the epidermis, the infection sites feel rough to the touch; as the spore masses break through, the surface tissues take on a ragged and torn appearance.","Primary infections are usually light and develop from wind-borne urediospores that may have travelled long distances. The disease can develop rapidly when free moisture (rain or dew) and moderate temperatures prevail. If temperatures average about 20°C or more, the first generation of urediospores will be produced in 10-1 5 days. As plants mature, masses of black teliospores may be produced.","Stem rust can affect wheat, barley, triticale, and many other related grasses; it is found wherever temperate cereals are grown. The alternate hosts are Berberis and Mahonia spp.","If infection occurs during the early crop stages, the effects can be severe: reductions in tillering and losses in grain weight and quality. Under favorable conditions,,complete crop loss can occur.",Plant resistant varieties; Apply fungicides like propiconazole or azoxystrobin; Remove alternate hosts (Berberis and Mahonia spp.); Early detection and treatment
Stripe Rust (Yellow Rust),Puccinia striiformis,"The pustules of stripe rust, which. contain yellow to orange-yellow urediospores, usually form narrow stripes on the leaves (4). Pustules also can be found on leaf sheaths, necks, and glumes (5).","Primary infections are caused by wind-borne urediospores that may have travelled long distances. The disease may develop rapidly when free moisture (rain or dew) occurs and temperatures range between 1 0-20°C. At temperatures above 25OC, the production of urediospores is reduced or ceases and black teliospores are often produced (6).","Stripe rust can attack wheat, barley, triticale, and many other related grasses. The disease is found in all highland and/or temperate areas where cereals are grown. No alternate host is known.","Severe infections can cause yield losses, mainly by reducing the number of kernels per spike, test weights, and kernel quality.",Use resistant cultivars; Apply fungicides such as tebuconazole or propiconazole; Monitor early in season; Practice crop rotation
Common and Dwarf Bunt (Stinking Smut),"Tilletia caries, T. foetida, T. controversa","The main symptoms caused by these three species are fungal structures called ""bunt balls,"" which resemble kernels but are completely filled with black teliospores. The bunt balls of common bunt, caused by T. caries and T. foetida, are about the same size and shape as the kernels they replace (7); those of dwarf bunt, caused by T. controversa, are more nearly spherical (8). When bunt balls are crushed, they give off a fetid or fishy odor. Infected spikes tend to be bluish green in color (or darker), and the glumes tend to spread apart slightly; the bunt balls often become visible after the soft dough stage (9, 10; page 11 ). A slight reduction in plant height is typical of common bunt, while a pronounced reduction in height is typical of dwarf bunt.","Spores lying dormant in the soil or on seed germinate and infect emerging seedlings. Infection is favored by cool temperatures during germination. The disease develops systemically, with visible symptoms appearing after heading. (continued)","Wheat and (less commonly). triticale are affected by these diseases, as are several other related grasses. Common and dwarf bunts can occur worldwide. Both are limited to temperate climates; dwarf bunt occurs in areas having prolonged snow cover.",Considerable yield losses can occur when susceptible cultivars are grown or chemical seed treatments are not used.,"Use certified seed treated with fungicides (carboxin, thiram, or tebuconazole); Plant resistant varieties; Rotate crops; Avoid planting in cool, wet conditions"
Karnal Bunt (Partial Bunt),Tilletia indica (sy n. Neovossia indica),"Karnal bunt is not easily detected prior to harvest, since it is usual for only a few kernels per spike to be affected by the disease. Following harvest, diseased kernels can be easily detected by visual inspection: a mass of black teliospores replaces a portion of the endosperm, and the pericarp may be intact or ruptured (1 1). Diseased kernels give off a fetid or fishy odor when crushed.","Karnal bunt is a seed- or soil-borne, floral infecting disease. lnoculum (teliospores) on or near the soil surface germinates, producing sporidia, which are carried by wind to the floral structures. These sporidia in turn germinate and penetrate the glumes, rachis, or the ovary itself. The fungus enters the newly formed kernel and develops in the intercellular space between the endosperm and seed coat. The degree of disease establishment and development depends on environmental conditions from spike emergence through grain filling.","Karnal bunt can affect wheat, triticale, rye, and several other related grasses, but not barley. The disease is endemic in the Asian Subcontinent and now in Mexico.","Karnal bunt is a relatively minor disease. Actual losses in yield are minimal, but the disease is on the quarantine lists of many countries and therefore of importance in world grain trade.",
Loose Smut,Ustilago tritici,"The entire inflorescence, except the rachis, is replaced by masses of smut spores (1 2). These black teliospores often are blown away by the wind, leaving only the bare rachis and remnants of other floral structures (1 3).","Wind blown teliospores that land on the flowers of wheat plants can germinate and infect the developing embryo of the kernel. The mycelium of the loose smut fungus remains dormant in the embryonic tissues of the kernel until the kernel begins to germinate. The mycelium then develops along with the growing point of the plant, and at flowering time replaces the floral parts of the spike with masses of black spores. Infection and disease development are favored by cool, humid conditions, which prolong the flowering period of the host plant.",The disease can occur wherever wheat is grown.,Yield losses depend on the number of spikes affected by the disease; incidence is usually less than one percent and rarely exceeds thirty percent of the spikes in any given location.,Use certified seed treated with systemic fungicides (carboxin or tebuconazole); Hot water treatment of seed; Plant resistant varieties
Flag Smut,Uroc ystis agrop yri,"Masses of black teliospores are produced in narrow strips just beneath the epidermis of leaves, leaf sheaths and occasionally the culms. Diseased plants often are stunted, tiller profusely and the spikes may not emerge. A severe infection usually induces the leaves to roll, producing an onion-type leaf appearance. The epidermis of older diseased plants tends to shred, releasing the teliospores (1 4).","Germinating kernels or very young seedlings are infected by germinating spores on the seed or in the soil. The disease continues to develop systemically, and the black subepidermal strips of teliospores become visible near heading. Infection is favored by low soil moisture and cool soil temperatures.","Bread wheats are the primary hosts of flag smut fungi, and the isolates attacking bread wheat tend to do so exclusively. There are few reports of flag smut on durum wheats and triticales. The disease is found in most winter wheat areas and in cool, fall-sown spring wheat areas.","Flag smut generally is not an economically important disease, but where present, yield losses can range from trace amounts to moderate levels (when susceptible cultivars are grown).",
Powdery Mildew,Erysiphe grarninis f. sp. tritici,"On all hosts, the first visible i symptoms of this disease are white to pale gray, fuzzy or powdery colonies of mycelia, and conidia on the upper surfaces of leaves and leaf sheaths (especially on lower leaves) (1 51, and sometimes on the spikes. Older fungal tissue is yellowish gray (16). This superficial fungal material can be rubbed off easily with the fingers. Host tissue beneath the fungal material becomes chlorotic or necrotic and, with severe infections, the leaves may die. Eventually, black spherical fruiting structures (cleistothecia) mav develoo in the mvcelia. and . can be seen without magnification. '","The development of powdery mildew is favored by cool (1 5-22OC), cloudy, and humid (75-100% relative humidity) conditions.","The fungus has a high degree of host specificity. Isolates infecting wheat do so exclusively; the same appears to be true for isolates infecting barley, oats, and rye. Further specialization exists in the form of races. Powdery mildew occurs worldwide in cool, humid, and semiarid areas where cereals are grown.",Powdery mildew can cause major yield losses if infection occurs early in the crop cycle and conditions remain favorable for development so that high infection levels are reached before heading.,"Apply fungicides such as propiconazole, tebuconazole, or azoxystrobin; Use resistant cultivars; Avoid excessive nitrogen fertilization; Improve air circulation"
Septoria Diseases,"Septoria Tritici Blotch; Mycosphaerella graminicola (Septoria tritici); Septoria Nodorum Blotch; Leptosphaeria nodorum (S. nodorum); Septoria Avenae Blotch; Leptosphaeria avenaria f .sp. triticea; (S. avenae; f.s~, triticea)","Initial infection sites tend to be irregular in shape, oval to elongated chlorotic spots or lesions. As these sites expand, the centers of the lesions become pale, straw colored, and slightly necrotic, often with numerous small black dots (pycnidia) (1 7). The lesions of septoria tritici blotch tend to be linear and restricted laterally (1 81, while those of septoria nodorum blotch (1 9; page 23) and septoria avenae blotch are more lens shaped. All above ground plant parts can be affected. Light infection produces only scattered lesions, but heavy infection can kill leaves, spikes (20 is S. nodorum; page 231, or even the entire plant. Identification of species in the field can be difficult, and microscopic examination is often necessary. (continued)","Initial infections tend to be on the lower leaves, progressing to the upper leaves and spikes if environmental conditions remain favorable. Cool temperatures (lo0-1 5OC) and prolonged wet, cloudy weather favors the development of these diseases.","These are primarily diseases of wheat, but other cereals are somewhat susceptible. The diseases are limited to temperate wheat-growing areas where cool and moist conditions prevail.","Major losses can occur, through seed shrivelling and lower test weights, if these diseases reach severe levels prior to harvest.","Apply fungicides like propiconazole, tebuconazole, or azoxystrobin; Use resistant varieties; Practice crop rotation; Remove crop debris"
Helminthosporium Leaf Blotch (Spot Blotch),"Cochliobolus sativus; (Helminthosporium sativum); Syn. Bipolaris sorokiniana, Drechslera sorokiniana","Lesions caused by this disease are elongated to oval in shape and are generally a dark brown color. As lesions mature, the centers often turn a light brown to tan color, surrounded by an irregular dark brown ring (21 on leaf; 22 on spike).","Primary infections tend to be on the lower leaves, beginning as chlorotic flecks or spots. These infection sites enlarge, turn dark brown, and often coalesce. When the disease is severe, affected leaves or leaf sheaths may die prematurely.","Spot blotch affects wheat, triticale, barley, and most grasses. It is found worldwide, but is especially prevalent in more humid and higher rainfall areas.","If infection occurs early in the crop cycle and conditions remain favorable for development, complete defoliation is possible; major reductions in yield and severely shrivelled kernels will then result.",
Tan Spot (Yellow Leaf Spot or Blotch),"Pyrenophora trichostorna; fHelminthhosporium tritici-repentis); S y n. P. tritici-repentis, Drechslera tritici -repentis","At first, lesions appear as tan to brown flecks, which expand into large, irregular, oval- or lens-shaped tan blotches with a yellow or chlorotic margin (23). As these spots coalesce, large blotches are formed. The development of a dark brown to black spot in the center of the lesion is characteristic of the disease. As the disease progresses, entire leaves, spikes, and even whole plants may be killed.","Initial infections come from diseased crop debris in the soil, or from diseased grass hosts. Usually the lower leaves are infected first, and the disease progresses to the upper leaves and leaf sheaths if conditions are favorable. This disease develops over a wide range of temperatures and is favored by long periods (1 8 hours or more) of dew or rain.","Tan spot can affect wheat and several related grasses; triticale, barley, and rye are less frequently affected. The disease is found in the major temperate wheat -growing areas.","When severe, tan spot can cause premature death of the leaves, thereby reducing yield by lowering test weights and producing a high degree of kernel shrivelling. This disease has become more important with the increased adoption of minimum and/or no-till agronomic practices, which leave crop debris in place.",
Alternaria Leaf Blight,Alternaria triticina,"Small, chlorotic, oval - or elliptical- shaped lesions appear and, as they enlarge, these lesions become irregular in shape. The chlorotic borders of the lesions may become diffuse and turn light to dark brown in color (24). Lesions are difficult to distinguish from those caused by Helrninthosporiurn spp. Infection usually starts on the lower leaves, but symptoms can be found on all plant parts.","The fungus survives as conidia on seed or as mycelia within seed. Sporulation on lower leaves provides inoculum that can be dispersed by wind, leading to secondary spread of the disease. Seed -borne inoculum often results in spike infections late in the crop cycle. High humidity or irrigation, as well as warmer temperatures (20' to 25'C) favor infection and disease development.","Bread wheat and durum wheat, as well as several related grasses, are the primary hosts. The disease is common in the eastern and central areas of the Asian Subcontinent.",Alternaria leaf blight can be very severe if environmental conditions are favorable for disease development; major losses can result when susceptible cultivars are grown.,
Fusarium. Leaf Blotch (Snow Mold),Calonectria nivalis (Fusarium nivale),"The blotching caused by this organism becomes evident on leaves at about late-joint to early-boot growth stage. Young lesions occur as oval to elliptical, greyish green mottled areas, usually located where the leaf bends (25). The lesions enlarge rapidly, developing into large, ""eyespot"" blotches with bleached or light grey centers; the leaves tend to split or shred, beginning at the centers of the lesions (26). The fungus also can cause seedling blight, foot rot, head scab (27) and, in winter cereals, pink snow mold.","Spores are produced on crop debris left on or near the soil surface. These spores are transmitted to leaves by the wind or by splashing rain. Disease development is favored by cool, moist weather.","Generally, the disease affects durum wheat and triticale more than bread wheat or rye; oats and barley appear to be immune. Reports indicate that the disease is restricted to East Africa, the highland areas of Mexico, the Andean region of South America, and parts of southern China.","Severe disease development can cause complete defoliation, resulting in poor grain development, shrivelling, and low test weights (28).",
Scab (Head Blight),Fusarium spp.,"lnfected florets (especially the outer glumes) become slightly darkened and oily in appearance (29). Conidiospores are produced in sporodochia, which gives the spike a bright pinkish color (30). lnfected kernels may be permeated with mycelia and the surface of the florets totally covered by white, matted mycelia.","Several species of Fusarium can attack the spikes of small grain cereals; the ovaries are infected at anthesis, and infection is favored by warm and humid weather during and after heading. Temperatures between lo0 and 28OC are required for infection. Once primary infection has occurred, the disease can spread from floret to floret by mycelial growth through the spike structure.",All small grain cereals may be affected by this disease. Fusarium spp. are present in nearly all soils and crop residues.,Severe levels of infection can cause yield losses of more than 50% and significant reductions in grain quality. Kernels from diseased spikes are often shrivelled. Harvested grain containing more than 5% infected kernels can contain enough toxin to be harmful to humans and animals.,"Apply fungicides at flowering stage (prothioconazole, tebuconazole); Use resistant varieties; Rotate with non-cereal crops; Avoid planting after corn"
Ergot,Claviceps purpurea,"At flowering, infected florets produce a yellowish, sticky, sweet exudate (containing conidia) that is visible on the glumes. As the spike matures, kernels of infected florets are replaced by brown to purplish black fungal structures (sclerotia or ""ergot bodies "") (31 ). These ergot bodies can reach 20 mm in length (32).","The primary infection originates from ascospores in fruiting bodies produced by sclerotia from the previous year's crop. Ascospores infect the florets, which then produce the sticky exudate containing conidia. Insects are attracted to the sweet exudate, and carry conidia to healthy florets in the same spike or to adjacent spikes. Rainy or humid weather favors the production of exudate and spores. An ergot body develops in each infected floret; these fungal structures can survive in the soil from one season to the next, and under dry conditions they can remain viable for many years. Sclerotia require cold temperatures before they can germinate.","Ergot is found in all small grain cereal crops, especially if sterility occurs for some reason (e.g., frost). Sterile florets tend to open and thus become more liable to infection. The disease is more prevalent in cool, humid climates.","Yield losses tend to be small, but losses due to discounted grain quality can be significant and occur worldwide.",
Black Point,"Alternaria, Helminthosporium, and Fusarium s pp .","The pericarps of maturing wheat kernels turn dark brown to black, with the discoloration usually restricted to the germ-end of the kernel (33; 34 is healthy seed). If caused by Alternaria spp., the dark color affects only the pericarp; if caused by Helminthosporium or Fusarium spp., the germ may be invaded and injured or killed. There are other fungi that can cause black point, but the three noted here are the most common.","Usually, kernels are infected by these fungi during the dough stage. If humid weather prevails for a few days to a week just prior to harvest, the incidence of infection will increase and black point will develop in many cultivars.","Wheat is the principal host; triticale and several related grasses also can be affected. Distribution is worldwide, wherever small grain cereals are grown.","Losses are due mainly to discounted prices paid for discolored grain; if Fusarium or Helminthosporium spp. are involved, the viability of the seed also may be reduced.",
Downy Mildew,Sclerophthora rnacrospora (Sclerospora rnacrospora),"Diseased plants tiller profusely; they have short, erect, irregular, or crooked yellowish- green culms; and the leaves are thick, erect, and usually in whorls (35). Tillers die prematurely or never head. If formed, the heads may be branched, and some of the floral tissues grow into leaflike structures (36).","The disease in cereals is generally associated with water-logged or excessively irrigated fields. Development is enhanced if temperatures range between lo0 and 25OC. Infection may be initiated by inoculum in the soil, or from diseased weed hosts, and water must be present for infection to occur. Symptoms are most obvious during the tilleringlstem elongation growth stages of the host plant.","The fungus has a broad host range, including small grain cereals, maize, sorghum, and most grasses. It may be found wherever soils become water -logged or are poorly drained.","Small, localized epidemics can occur when conditions are favorable. There have been no reports of widespread and destructive epidemics.",
Take-All,"Gaeumannomyces graminis f, sp. tritici; Syn. Ophiobolus grarninis","This fungus causes rotting of the roots and lower stems. Basal stem and leaf sheath tissues, as well as roots, may turn a shiny black color (37). When examined with a hand lens (10x1, dark fungal hyphae may often be found on the subcrown internode beneath the old leaf sheaths. Coarse, black runner hyphae are conspicuous on roots. Severe disease development is indicated by stunted plants with whitened stems and spikes (38, page 43). When infection occurs early in the crop cycle, the number of tillers is often reduced and spikes are often sterile.","The fungus persists on crop debris in the soil. Initial infections come from contact with hyphae or ascospores in the soil. Infection can occur throughout the crop cycle, but is favored by cool (12-18OC) soil temperatures and alkaline or nutrient deficient soils. Nitrate also appears to enhance disease development. Infections of the roots occurring in the fall and early spring generally progress to the crown and lower stem tissues; infections occurring later in the crop cycle cause less damage since they usually are confined to the roots. (continued)","The take -all fungus displays. a degree of specialization for wheat, triticale and several related grasses. The disease appears to be restricted to temperate wheat -growing areas.","Take-all is widespread in monocropped areas and has been known to cause considerable yield losses in winter wheat and fall- sown spring wheat areas, especially where liming or minimum tillage is practiced.",Practice crop rotation with non-cereal crops; Maintain proper soil pH; Use resistant varieties where available; Avoid excessive nitrogen
Eyespot (Straw breaker),Pseudocercosporella herpotrichoides; Sy n . Cercosporella herpotrichoides,"The most obvious symptoms of this disease are the eye-shaped, elliptical lesions produced on the internodes of the lower stem (39). The lesions are bordered by dark brown to greenish brown rings, have straw-colored centers, and frequently develop on the leaf sheath at soil level. These lesions may coalesce and lose their distinct ""eye-spot"" appearance. When disease development is severe, the stem or culm may break near the ground or through the lesion where the stem is weakened (40). Symptoms do not appear on the roots.","Primary infection occurs from conidia or mycelia produced on crop debris on or near the soil surface; contact with the developing coleoptile or basal areas of young culms is required. The fungus is limited to the basal areas of the plant. Disease development is favored by cool, damp weather, and by high humidity at the soil level.","Wheat, triticale, rye, oats, and other related grasses can be affected by the disease, with wheat being the most susceptible; winter wheat and fall-sown spring wheat are more frequently damaged. Eyespot occurs in cool, moist climates where fall-sown cereals predominate.","Eyespot may kill individual tillers or even whole plants. More commonly, yield losses result from reduced kernel size and number, and from lodging.",Apply fungicides such as prothioconazole or tebuconazole; Use resistant varieties; Practice crop rotation; Reduce crop residue
