disease_name,pathogen,symptoms,development,hosts_distribution,importance,treatments
Sharp Eyespot and Rhizoctonia Root Rot,Rhizoctonia solani,"The primary symptoms of sharp eyespot are the lesions that develop on basal leaf sheaths; these lesions are similar to those caused by Pseudocercosporella herpotrichoides (eyespot). Sharp eyespot lesions are more superficial and more sharply outlined than those typical of eyespot. The margins are dark brown with pale, straw-colored centers (41 ). The mycelia often present in the centers of lesions are easily removed by rubbing. Roots can also be affected, usually becoming brown in color and reduced in number. The disease can cause stunting and a reduction in the number of tillers.","Infection is highly dependent upon environmental conditions. Disease development is favored by dry, sandy soils, cool temperatures, and high humidity. The fungus persists in soil and in crop debris, and invades root and crown tissues.","Rhizoctonia solani has perhaps the widest host range of any pathogen, attacking most cultivated crops; virtually all members of the Graminae family are susceptible. It is a ubiquitous fungus, present almost everywhere in soil and crop debris.","The disease is usually more severe in fields that are continuously sown to cereals, especially winter wheat. However, no major or widespread epidemics have been reported.",
"Common Root Rot, Foot Rot, and Crown Rot","Helminthosporium, Fusarium, and Pythiurn spp.","These fungi produce a darkening or browning of the root, crown, and basal culm tissues. Individual plants or groups of plants may lodge. White spikes often are visible just prior to normal physiological maturity (42). lnfection early in the crop development can cause pre- or post- emergence ""damping off"" of seedlings (43). Since each fungus can attack a different plant part at a different growth stage, positive field identification of the causal agent is difficult.","The roots or crown tissues are infected by conidia or mycelia present on crop debris, Infection by and development of common root rot (Helminthosporium spp. ) is favored by warm, dry soils when the plants are under stress. The root, foot, and crown rots caused by Fusarium spp. are generally favored by cooler, moist soils, and wet soils favor Pythium spp.",These diseases affect all major small grain cereals grown in the temperate regions of the world.,"Major epidemics have not been reported. However, localized losses can result from thinned stands, a decrease in the number of tillers, and from reductions in head size and test weights.",
Sclerotium Wilt (Southern Blight),Corticum rolfsii (Sclerotium rolfsii),"If infection occurs early in the crop cycle, pre - or post-emergence ""damping off"" of seedlings can result. Diseased tissues will frequently have white, fluffy fungal mycelia on the surface (441, which often permeate the soil surrounding the plant. Subsequent disease development results in rotted culms, crowns, and roots, and the eventual death of the plant; this leads to the appearance of ""white heads"" or spikes in the green crop (45). Sclerotia are commonly found on the crown tissues, culms, or near the soil surface (46). Young sclerotia are whitish and turn brown to dark brown with age.","Sclerotium rolfsii can attack the plant at any stage of development. Fungal mycelia on crop debris or sclerotia serve as primary inoculum. Infection and disease development are favored by warm (20°C +) temperatures, excessive moisture, and acid soils.","Most cereals and grasses, plus many broad -leaf plant species are susceptible, and the fungus is widespread in tropical and subtropical environments.",The disease is seldom a problem in traditional wheat -growing areas.,Practice crop rotation with non-host crops; Improve soil drainage to reduce excessive moisture; Apply fungicides such as flutolanil or azoxystrobin if available; Remove and destroy infected plant debris; Maintain proper soil pH (avoid highly acidic soils); Use clean, disease-free seed
Black Molds (Sooty Molds),"Alrernaria, Cladosporium, Stemphylium, Epicoccum; and other species","The typical symptom is the blackened appearance of mature or dead spikes, caused by a superficial accumulation of mycelia and sporulating fungal tissue (47).","When wet or humid weather occurs at or near crop maturation, or when plants are heavily infested with aphids, or when plants die prematurely, they may be invaded by one or more of these fungi. Technically, black molds do not constitute a disease, since the fungi are saprophytic and invade only dead or dying plant tissue.",Black molds affect any kind of dead or dying plant tissue; distribution is worldwide.,"Black molds generally are not economically important. Under humid or rainy conditions, the fungi can invade mature kernels, causing discoloration, black point, or smudge. Bacterial Diseases Bacterial plant pathogens are small unicellular rods . from 1 to 3 pm in length. They do not have a well-defined nucleus, nor a nuclear membrane. Bacteria are spread by insects, air currents, splashing rain, and by mechanical means. Free moisture usually is necessary for infection, and penetration of host tissue occurs through wounds or stomata1 openings. These pathogens invade the vascular system or intercellular spaces in host tissue, and necrosis results from toxins produced or enzymatic activity of the bacteria.",
Bacterial Black Chaff and Bacterial Stripe,"Xanthornonas carnpestris pv. translucens; Syn. X. translucens, X. translucens f.sp. undulosa,; X. campestris pv. undulosa","Black chaff and bacterial stripe are both caused by the same organism; the site and extent of the symptoms depends on the strain of the bacterium, the affected cultivar and environmental conditions. ""Bacterial black chaff"" occurs primarily on the glumes (48); ""bacterial stripe"" occurs primarily on the leaves and/or leaf sheaths (49). Initial symptoms are narrow chlorotic lesions or stripes that have a water- soaked appearance; droplets of sticky yellowish exudate may appear with extended periods of rain or dew (50). The exudate dries to form crusty droplets or a translucent film on the surface of affected tissues. The film may crack and give a scaly appearance. If infection occurs early in the crop cycle, the spike may be infected, resulting in sterility; when the disease is severe, entire leaves or spikes may be killed.","The bacterium can be seed borne and persists on crop residues in the soil, tolerating warm as well as freezing temperatures. Free moisture is required for infection and spread of the disease. Infection occurs through stomata and broken epidermal tissue. The disease is spread by splashing rain, plant contact, and insects.",These diseases occur worldwide on all small grain cereals and many grasses.,"Black chaff and bacterial stripe rarely cause significant damage, even though symptoms often may be extensive.",
Basal Glume Rot and Bacterial Leaf Blight,Pseudomonas syringae pv. atrofaciens; Syn. Pseudomonas atrofaciens,"The leaves, culms, and spikes of v wheat and triticale can be infected. Infections begin as small, dark green, water-soaked lesions that turn dark brown to blackish in color. On the spikelets, lesions generally start at the base of the glume and may eventually extend over the entire glume (51 1. Diseased glumes have a translucent appearance when held toward the light. Dark brown to black discoloration occurs with age. The disease may spread to the rachis, and lesions may also develop on the kernels (52). Under wet or humid conditions, a whitish gray bacterial ooze may be present. Stem infections result in dark discoloration of the stem; leaf infections result in small, irregular, water-soaked lesions. Symptoms can be confused with those of other bacterial diseases, genetic melanism (false black chaff), septoria nodorum blotch (glume blotch), and frost damage.","The pathogen survives on crop debris, as well as various grass hosts. It is disseminated by splashing rain or by insects, and can be seed borne. s",The disease can affect all small grain cereal crops; distribution is worldwide. i,"Basal glume rot usually is not economically important, but is frequently reported in humid cereal -growing areas.",
Bacterial Spike Blight (Yellow Ear Rot),Corynebacterium tritici,"A yellow exudate on the spikes is indicative of bacterial spike blight. When dry, the exudate is white. Often the spikes and necks will emerge as a distorted, sticky mass (53). The early leaves may also be wrinkled or twisted. This bacteria is associated with the nematode Anguina tritici in some regions.","The bacteria persists in organic material in the soil. It attacks wheat when it comes in contact with the plant apex within the leaf whorl, and this transmission is often facilitated by the nematode A. tritici.","Wheat is the only cultivated host, though some wild grasses are susceptible to attack. The disease is frequently reported in the Asian Subcontinent.","Bacterial spike blight is not economically important. Viral Diseases Viruses are the smallest pathogens presented irl this field guide, and only one viral disease (BYD) is discussed. The infectious viral particle is called a virion, which is a stable, non-multiplying stage by which the virus is transferred from one plant to another. Viruses multiply in the host plant, and transmission may occur via several means: by insects and mites (especially sucking insects, such as aphids), by nematodes, by seed, by pollen, by fungi, by soil and mechanically. Viral diseases are often difficult to detect because infected hosts may not display visible symptoms, or symptoms may closely resemble those of various physiological disorders or genetic abnormalities. Identification can be facilitated by determining which vectors are present and the host range; in many cases, positive identification requires the use of an electron microscope and serological techniques.",
Barley Yellow Dwarf,Barley yellow dwarf virus (BYDV),"The symptoms of barley yellow dwarf (BYD) vary with the affected crop cultivar, the age of the plant at the time of infection, the strain of the virus, and environmental conditions. Symptoms often are masked by or confused with other problems. Affected plants show a yellowing (54) or reddening (on oats and some wheats) of leaves, stunting, an upright posture of thickened stiff leaves (551, reduced root growth, delayed (or no) heading, and a reduction in yield. The heads of affected plants tend to remain erect and become black and discolored during ripening due to colonization by saprophytic fungi.",Temperatures of approximately 20°C are favorable for disease development and symptoms appear approximately 14 days after infection.,"The term barley yellow dwarf virus (BYDV) includes several related viruses that are all aphid transmitted. Over 20 species of aphids may act as vectors. BYD is probably the most widely distributed viral disease of cereals in the world. It attacks not only wheat, but also barley, triticale, oats, and many other grass species.","Infections occurring early in the crop cycle can result in yield losses of more than 20%, and much larger losses have been recorded.",
